{
	"$schema": "http://json-schema.org/draft-07/schema#",
	"title": "crawlberg E2E Fixture (Alef format)",
	"description": "Defines a single end-to-end crawl/scrape scenario with mock HTTP responses in the Alef fixture format.",
	"type": "object",
	"required": ["id", "description", "assertions"],
	"properties": {
		"id": {
			"type": "string",
			"pattern": "^[a-z0-9_]+$",
			"description": "Unique identifier used as test function name."
		},
		"description": {
			"type": "string"
		},
		"preserve_input_urls": {
			"type": "boolean",
			"description": "Keep the fixture's input URLs instead of replacing their origin with the mock server."
		},
		"test_timeout_ms": {
			"type": "integer",
			"minimum": 0,
			"description": "Timeout for the generated test in milliseconds."
		},
		"tags": {
			"type": "array",
			"items": { "type": "string" }
		},
		"docs": {
			"type": "object",
			"additionalProperties": false,
			"required": ["topic", "stem", "title"],
			"properties": {
				"topic": { "type": "string", "description": "Docs section this fixture is published under." },
				"stem": { "type": "string", "description": "URL slug for the generated docs page." },
				"title": { "type": "string", "description": "Human-readable page title." }
			},
			"description": "Docs-site publication metadata. Present on every fixture."
		},
		"category": {
			"type": "string",
			"description": "Overrides the fixture category otherwise inferred from its directory."
		},
		"call": {
			"type": "string",
			"description": "Overrides which API call the generated test invokes (e.g. \"batch_scrape\")."
		},
		"mock_response": {
			"type": "object",
			"required": ["status"],
			"additionalProperties": false,
			"properties": {
				"status": { "type": "integer", "minimum": 100, "maximum": 599 },
				"headers": { "type": "object", "additionalProperties": { "type": "string" } },
				"body": {
					"description": "Any JSON value. alef deserialises it as Option<serde_json::Value>, so a non-string body is valid."
				},
				"stream_chunks": {
					"type": "array",
					"items": {},
					"description": "SSE chunks, each sent as `data: <chunk>`. A non-empty array is what makes the fixture a streaming mock."
				}
			},
			"description": "Single-response shorthand, used instead of input.mock_responses."
		},
		"skip": {
			"type": "object",
			"properties": {
				"languages": {
					"type": "array",
					"items": { "type": "string" },
					"description": "Language bindings to skip this test for."
				},
				"reason": {
					"type": "string",
					"description": "Human-readable explanation for why this test is skipped."
				}
			}
		},
		"input": {
			"type": "object",
			"properties": {
				"mock_responses": {
					"type": "array",
					"items": {
						"type": "object",
						"properties": {
							"path": { "type": "string" },
							"method": { "type": "string", "default": "GET" },
							"status_code": { "type": "integer" },
							"headers": { "type": "object", "additionalProperties": { "type": "string" } },
							"body_file": { "type": "string", "description": "Path relative to fixtures/responses/" },
							"body_inline": {
								"type": "string",
								"description": "Inline response body (alternative to body_file)"
							}
						}
					},
					"description": "Mock HTTP responses for the test scenario."
				},
				"batch_urls": {
					"type": "array",
					"items": { "type": "string" },
					"description": "List of URLs/paths to batch-scrape (not part of CrawlConfig)"
				},
				"rate_limit_delay_ms": {
					"type": "integer",
					"minimum": 0,
					"description": "Delay between requests in milliseconds (not part of CrawlConfig)"
				},
				"crawl_strategy": {
					"type": "string",
					"enum": ["bfs", "dfs", "best_first", "adaptive"],
					"description": "Deprecated at this level: `crawl_strategy` is a real CrawlConfig field, so put it in `input.config` where it is actually applied. Setting it here has no effect."
				},
				"content_filter": {
					"type": "string",
					"description": "Content filter type (e.g. 'bm25', 'none') (not part of CrawlConfig)"
				},
				"bm25_query": {
					"type": "string",
					"description": "BM25 query string for content filtering (not part of CrawlConfig)"
				},
				"bm25_threshold": {
					"type": "number",
					"description": "BM25 score threshold for content filtering (not part of CrawlConfig)"
				},
				"config": {
					"type": "object",
					"properties": {
						"max_depth": { "type": "integer", "minimum": 0 },
						"max_pages": { "type": "integer" },
						"max_links_per_page": {
							"type": "integer",
							"minimum": 0,
							"description": "Maximum links enqueued from a single page. Defaults to 10000. Links past the cap are dropped and a warning is logged; bounds fan-out from one hostile or pathological page."
						},
						"respect_robots_txt": { "type": "boolean" },
						"soft_http_errors": { "type": "boolean" },
						"request_timeout": {
							"type": "integer",
							"minimum": 0,
							"description": "Request timeout in milliseconds"
						},
						"user_agent": { "type": "string" },
						"stay_on_domain": { "type": "boolean" },
						"include_paths": {
							"type": "array",
							"items": { "type": "string" },
							"description": "Regex patterns for URLs to include"
						},
						"exclude_paths": {
							"type": "array",
							"items": { "type": "string" },
							"description": "Regex patterns for URLs to exclude"
						},
						"path_patterns_match_query": {
							"type": "boolean",
							"description": "Match include_paths/exclude_paths against path?query instead of just path. Defaults to false"
						},
						"path_patterns_match_url": {
							"type": "boolean",
							"description": "Match include_paths/exclude_paths against the full URL (scheme://host[:port]/path?query, no fragment). Takes precedence over path_patterns_match_query. Defaults to false"
						},
						"dedup_include_query": {
							"type": "boolean",
							"description": "Include the sorted query string in the crawl-dedup key. Defaults to true, so ?id=1 and ?id=2 are distinct pages; false merges them"
						},
						"strip_tracking_params": {
							"type": "boolean",
							"description": "Strip tracking_params from a discovered URL before it is deduplicated, fetched, and reported. Defaults to false"
						},
						"tracking_params": {
							"type": "array",
							"items": { "type": "string" },
							"description": "Query parameter name patterns stripped when strip_tracking_params is true. A trailing '*' matches by prefix. Defaults to [\"utm_*\", \"fbclid\", \"gclid\", \"ref\"]"
						},
						"allow_subdomains": { "type": "boolean" },
						"max_redirects": { "type": "integer", "minimum": 0 },
						"max_body_size": { "type": "integer", "minimum": 0, "description": "Max body size in bytes" },
						"max_concurrent": { "type": "integer" },
						"rate_limit_ms": { "type": "integer", "minimum": 0 },
						"custom_headers": { "type": "object", "additionalProperties": { "type": "string" } },
						"subdomain_header_allowlist": {
							"type": "array",
							"items": { "type": "string" },
							"description": "Custom header names explicitly permitted on admitted subdomains; empty by default. Authentication remains seed-host-only."
						},
						"cookies_enabled": { "type": "boolean" },
						"auth": {
							"type": "object",
							"description": "Authentication config — one of basic, bearer, or header",
							"properties": {
								"basic": {
									"type": "object",
									"required": ["username", "password"],
									"properties": {
										"username": { "type": "string" },
										"password": { "type": "string" }
									}
								},
								"bearer": {
									"type": "object",
									"required": ["token"],
									"properties": {
										"token": { "type": "string" }
									}
								},
								"header": {
									"type": "object",
									"required": ["name", "value"],
									"properties": {
										"name": { "type": "string" },
										"value": { "type": "string" }
									}
								}
							}
						},
						"retry_count": { "type": "integer", "minimum": 0 },
						"retry_codes": { "type": "array", "items": { "type": "integer" } },
						"retry_initial_delay_ms": {
							"type": "integer",
							"minimum": 0,
							"description": "Initial delay in milliseconds before the first retry, doubled on each subsequent attempt. Defaults to 100"
						},
						"retry_max_delay_ms": {
							"type": "integer",
							"minimum": 0,
							"description": "Upper bound in milliseconds on the exponential retry backoff. Defaults to 60000"
						},
						"rate_limit_jitter_ratio": {
							"type": "number",
							"minimum": 0,
							"maximum": 1,
							"description": "Fraction of the per-domain rate-limit delay to randomly jitter by. Defaults to 0 (no jitter)"
						},
						"remove_tags": {
							"type": "array",
							"items": { "type": "string" },
							"description": "CSS selectors for elements to remove"
						},
						"content": {
							"type": "object",
							"description": "Content extraction configuration",
							"properties": {
								"expand_abbreviations": {
									"type": "boolean",
									"description": "Append abbreviation titles in parentheses. Default: true"
								},
								"escape_misc": {
									"type": "boolean",
									"description": "Escape literal Markdown metacharacters. Default: false"
								},
								"include_icon_labels": {
									"type": "boolean",
									"description": "Include names and anchor tooltips of decorative linked SVG icons. Default: true"
								},
								"escape_asterisks": {
									"type": "boolean",
									"description": "Escape literal asterisks in text. Default: false"
								},
								"extract_metadata": {
									"type": "boolean",
									"description": "Prepend a YAML frontmatter block to markdown.content. Default: true"
								}
							}
						},
						"map_search": { "type": "string", "description": "Search keyword filter for map results" },
						"map_limit": { "type": "integer", "minimum": 1, "description": "Limit number of map results" },
						"download_assets": { "type": "boolean" },
						"asset_types": {
							"type": "array",
							"items": {
								"type": "string",
								"enum": [
									"document",
									"image",
									"audio",
									"video",
									"font",
									"stylesheet",
									"script",
									"archive",
									"data",
									"other"
								]
							}
						},
						"max_asset_size": { "type": "integer", "minimum": 0 },
						"browser": {
							"type": "object",
							"description": "Browser config for headless rendering",
							"properties": {
								"mode": {
									"type": "string",
									"enum": ["auto", "always", "never"],
									"description": "When to use browser fallback"
								},
								"endpoint": {
									"type": "string",
									"description": "CDP WebSocket endpoint URL for external browser"
								},
								"timeout": {
									"type": "integer",
									"minimum": 0,
									"description": "Browser page load timeout in ms"
								},
								"wait": {
									"type": "string",
									"enum": ["network_idle", "selector", "fixed"],
									"description": "Wait strategy after navigation"
								},
								"wait_selector": {
									"type": "string",
									"description": "CSS selector to wait for when wait is selector"
								},
								"extra_wait": {
									"type": "integer",
									"minimum": 0,
									"description": "Extra wait time after wait condition in ms"
								}
							}
						},
						"user_agents": { "type": "array", "items": { "type": "string" } },
						"capture_screenshot": { "type": "boolean" },
						"proxy": {
							"type": "object",
							"properties": {
								"url": { "type": "string" }
							}
						},
						"download_documents": {
							"type": "boolean",
							"description": "Enable document downloading (PDF, etc.)"
						},
						"document_mime_types": {
							"type": "array",
							"items": { "type": "string" },
							"description": "Allowlist of MIME types to download"
						},
						"document_max_size": {
							"type": "integer",
							"minimum": 0,
							"description": "Max document size in bytes"
						},
						"follow_document_urls": { "type": "boolean" },
						"document_url_depth": { "type": "integer", "minimum": 0 },
						"warc_output": { "type": "string", "description": "Path to write WARC output file" },
						"browser_profile": {
							"type": "string",
							"description": "Named browser profile for persistent sessions"
						},
						"save_browser_profile": {
							"type": "boolean",
							"description": "Save changes back to browser profile"
						},
						"ssrf": {
							"type": "object",
							"properties": {
								"deny_private": { "type": "boolean" },
								"allowlist": {
									"type": "array",
									"items": {
										"type": "object",
										"required": ["type", "value"],
										"properties": {
											"type": { "type": "string", "enum": ["exact", "suffix", "cidr"] },
											"value": { "type": "string" }
										},
										"additionalProperties": false
									}
								},
								"max_redirects": {
									"type": "integer",
									"minimum": 0,
									"maximum": 255,
									"description": "Maximum redirects followed during SSRF validation. WARNING: CrawlConfig.max_redirects (the top-level config property) is the effective knob at runtime for how many redirects the engine actually follows — SsrfPolicy.max_redirects still deserializes for backward compatibility but is NOT read at runtime. A fixture must not rely on this field to bound the number of redirect hops; set the top-level max_redirects instead."
								}
							},
							"additionalProperties": false
						}
					}
				},
				"actions": {
					"type": "array",
					"items": { "type": "object" },
					"description": "Page interaction actions (Click, Type, Scroll, Wait, ExecuteJs, etc.)"
				},
				"batch_mode": {
					"type": "string",
					"enum": ["scrape", "crawl"],
					"description": "Whether batch operation is scrape or crawl (default: scrape)"
				}
			}
		},
		"assertions": {
			"type": "array",
			"items": {
				"type": "object",
				"required": ["type"],
				"properties": {
					"type": {
						"type": "string",
						"enum": [
							"equals",
							"contains",
							"not_empty",
							"greater_than_or_equal",
							"less_than_or_equal",
							"greater_than",
							"less_than",
							"contains_all",
							"is_empty",
							"not_contains",
							"error",
							"is_true",
							"is_false"
						],
						"description": "Assertion type."
					},
					"field": {
						"type": "string",
						"description": "Dot-separated field path for the assertion target."
					},
					"value": {
						"description": "Expected value. For 'error' type without value, indicates any error. For 'error' with value, indicates specific error type."
					},
					"skip": {
						"description": "Declare that this one assertion cannot be generated somewhere. Without it, a field the availability oracle cannot resolve is a fatal codegen error, because a silently dropped assertion produces a test that passes while asserting nothing. The skip is still counted and bucketed by owner in the end-of-run summary.",
						"oneOf": [
							{ "type": "boolean", "description": "true skips every language and is attributed to alef (not_representable)." },
							{
								"type": "object",
								"additionalProperties": false,
								"properties": {
									"languages": {
										"type": "array",
										"items": { "type": "string" },
										"description": "Languages this assertion is skipped for. Empty or absent means all."
									},
									"kind": {
										"type": "string",
										"enum": ["not_representable", "language_limitation"],
										"description": "Which backlog owns the debt. not_representable = alef cannot express this shape yet. language_limitation = the binding or ABI genuinely cannot reach the field, usually permanent. Defaults to not_representable."
									},
									"reason": {
										"type": "string",
										"description": "Why this assertion cannot be generated."
									}
								}
							}
						]
					}
				}
			},
			"description": "Flat array of assertions to verify test outcomes."
		}
	},
	"additionalProperties": false
}
