{
	"id": "redirect_to_404",
	"description": "Redirect target returns 404 Not Found",
	"docs": {
		"topic": "redirect",
		"stem": "redirect-to-404",
		"title": "Redirect target returns 404 Not Found"
	},
	"tags": ["redirect", "error", "crawl"],
	"skip": {
		"languages": ["wasm"],
		"reason": "Redirect-to-404 semantics differ on wasm fetch shim (status mapping)"
	},
	"input": {
		"mock_responses": [
			{
				"path": "/",
				"method": "GET",
				"status_code": 301,
				"headers": {
					"location": "/gone"
				},
				"body_inline": ""
			},
			{
				"path": "/gone",
				"method": "GET",
				"status_code": 404,
				"headers": {
					"content-type": "text/html; charset=utf-8"
				},
				"body_inline": "<html><body><h1>404 Not Found</h1></body></html>"
			}
		],
		"config": {
			"respect_robots_txt": false
		}
	},
	"assertions": [
		{
			"type": "contains",
			"field": "final_url",
			"value": "/gone"
		},
		{
			"type": "equals",
			"field": "redirect_count",
			"value": 1
		},
		{
			"type": "contains",
			"field": "error",
			"value": "404"
		}
	]
}
