{
	"id": "rate_limit_zero_no_delay",
	"description": "Rate limiter with zero delay does not slow crawling",
	"docs": {
		"topic": "rate-limit",
		"stem": "rate-limit-zero-no-delay",
		"title": "Rate limiter with zero delay does not slow crawling"
	},
	"tags": ["rate_limit", "crawl"],
	"input": {
		"mock_responses": [
			{
				"path": "/",
				"headers": {
					"content-type": "text/html"
				},
				"body_inline": "<html><body><a href=\"/p1\">P1</a></body></html>"
			},
			{
				"path": "/p1",
				"headers": {
					"content-type": "text/html"
				},
				"body_inline": "<html><body><h1>P1</h1></body></html>"
			}
		],
		"rate_limit_delay_ms": 0,
		"config": {
			"max_depth": 1
		}
	},
	"assertions": [
		{
			"type": "equals",
			"field": "crawl.pages_crawled",
			"value": 2
		}
	]
}
