{
	"id": "content_remove_tags",
	"description": "Removes specified HTML elements by CSS selector before processing",
	"docs": {
		"topic": "content",
		"stem": "content-remove-tags",
		"title": "Removes specified HTML elements by CSS selector before processing"
	},
	"tags": ["content", "filtering"],
	"input": {
		"mock_responses": [
			{
				"status_code": 200,
				"headers": {
					"content-type": "text/html; charset=utf-8"
				},
				"body_file": "html/main_content_page.html"
			}
		],
		"config": {
			"respect_robots_txt": false,
			"remove_tags": ["nav", "aside", "footer"]
		}
	},
	"assertions": [
		{
			"type": "not_empty",
			"field": "html"
		}
	]
}
