{
	"id": "sitemap_from_robots_txt",
	"description": "Discovers sitemap via robots.txt Sitemap directive",
	"docs": {
		"topic": "sitemap",
		"stem": "sitemap-from-robots-txt",
		"title": "Discovers sitemap via robots.txt Sitemap directive"
	},
	"tags": ["sitemap", "robots", "map"],
	"input": {
		"mock_responses": [
			{
				"path": "/robots.txt",
				"method": "GET",
				"status_code": 200,
				"headers": {
					"content-type": "text/plain"
				},
				"body_inline": "User-agent: *\nAllow: /\n\nSitemap: /sitemap.xml"
			},
			{
				"path": "/sitemap.xml",
				"method": "GET",
				"status_code": 200,
				"headers": {
					"content-type": "application/xml"
				},
				"body_file": "xml/sitemap_basic.xml"
			},
			{
				"path": "/",
				"method": "GET",
				"status_code": 200,
				"headers": {
					"content-type": "text/html; charset=utf-8"
				},
				"body_inline": "<html><body><h1>sitemap_from_robots_txt</h1></body></html>"
			}
		],
		"config": {
			"respect_robots_txt": true
		}
	},
	"assertions": [
		{
			"type": "equals",
			"field": "urls.length",
			"value": 4
		}
	]
}
