{
	"id": "crawl_empty_page_no_links",
	"description": "Crawl completes when child page has no outgoing links",
	"docs": {
		"topic": "crawl",
		"stem": "crawl-empty-page-no-links",
		"title": "Crawl completes when child page has no outgoing links"
	},
	"tags": ["crawl", "edge-case"],
	"input": {
		"mock_responses": [
			{
				"path": "/",
				"headers": {
					"content-type": "text/html"
				},
				"body_inline": "<html><body><a href=\"/leaf\">Leaf</a></body></html>"
			},
			{
				"path": "/leaf",
				"headers": {
					"content-type": "text/html"
				},
				"body_inline": "<html><body><p>No links here at all.</p></body></html>"
			}
		],
		"config": {
			"max_depth": 2,
			"max_concurrent": 1
		}
	},
	"assertions": [
		{
			"type": "equals",
			"field": "pages.length",
			"value": 2
		}
	]
}
